Genre,ISBN-13,ISBN-10,Title,Subtitle,Author,Publish Date,URL,Scanned Input,Tags,Thumbnail,Description
mythology,9780140443226,0140443223,The Mabinogion,,,1976-11-18,https://books.google.com/books/about/The_Mabinogion.html?hl=&id=I4KMEAAAQBAJ,9780140443226,"Tales, Translations into English, Short stories, Welsh literature, Celtic Mythology, Tales, wales, Fiction",http://books.google.com/books/content?id=I4KMEAAAQBAJ&printsec=frontcover&img=1&zoom=1&source=gbs_api,"'On the bank of the river he saw a tall tree: from roots to crown one half was aflame and the other green with leaves' Drawing on myth, folklore and history, the stories of the Mabinogion passed from generations of storytellers before they were written down in the thirteenth century in the form we now read them. Set in dual realms of the forests and valleys of Wales and the shadowy otherworld, the tales are permeated by a dreamlike atmosphere. In 'Math Son of Mathonwy' two brothers plot to carry off the virginal Goewin, while in 'Manawydan Son of Llˆyr' a chieftain roams throughout Britain after a spell is cast over his land. And King Arthur's court provides the backdrop to tales such as 'How Culhwch Won Olwen', in which a young man must complete many tasks before he can marry a giant's daughter, and 'Peredur Son of Evrawg' who strives to prove his valour as a knight. In his introduction, Jeffrey Gantz discusses the sources, oral tradition and artistry of the tales. This edition includes introductory prefaces to each story, a list for further reading and a note on pronunciation. For more than seventy years, Penguin has been the leading publisher of classic literature in the English-speaking world. With more than 1,700 titles, Penguin Classics represents a global bookshelf of the best works throughout history and across genres and disciplines. Readers trust the series to provide authoritative texts enhanced by introductions and notes by distinguished scholars and contemporary authors, as well as up-to-date translations by award-winning translators."
mythology,9780520232853,0520232852,The Saga of the Volsungs,The Norse Epic of Sigurd the Dragon Slayer,,1990,https://books.google.com/books/about/The_Saga_of_the_Volsungs.html?hl=&id=y7gwDwAAQBAJ,0520232852,"Tales, iceland, Sagas, Siegfried (Legendary character), Romances, Translations into English",http://books.google.com/books/content?id=y7gwDwAAQBAJ&printsec=frontcover&img=1&zoom=1&edge=curl&source=gbs_api,"Annotation The Saga of the Volsungsis an Icelandic epic of special interest to admirers of Richard Wagner, who drew heavily upon this Norse source in writing his Ring Cycle and a primary source for writers of fantasy such as J.R.R. Tolkien and romantics such as William Morris. A trove of traditional lore, it tells of love, jealousy, vengeance, war, and the mythic deeds of the dragonslayer, Sigurd the Volsung. Byock's comprehensive introduction explores the history, legends, and myths contained in the saga and traces the development of a narrative that reaches back to the period of the great folk migrations in Europe when the Roman Empire collapsed."
cookbook,9780785331643,0785331646,Hershey's 100th Anniversary,100 Years of Hershey's Favorites,,1994,https://books.google.com/books/about/Hershey_s_100th_Anniversary.html?hl=&id=TefcpwAACAAJ,0785331646,"Desserts, Cooking (Chocolate), Chocolate",,
mythology,9780192803733,0192803735,The Táin,,,2002,https://books.google.com/books/about/The_T%C3%A1in.html?hl=&id=I8WIQj4WNzkC,0192803735,"Irish Epic literature, Legends, Celtic Mythology, Tales, Translations into English, Heroes, British and irish fiction (fictional works by one author)",http://books.google.com/books/content?id=I8WIQj4WNzkC&printsec=frontcover&img=1&zoom=1&edge=curl&source=gbs_api,"The Táin Bó Cuailnge, centre-piece of the eighth-century Ulster cycle of heroic tales, is Ireland's greatest epic. It tells the story of a great cattle-raid, the invasion of Ulster by the armies of Medb and Ailill, queen and king of Connacht, and their allies, seeking to carry off the great Brown Bull of Cuailnge. The hero of the tale is Cuchulainn, the Hound of Ulster, who resists the invaders single-handed while Ulster's warriors lie sick. Thomas Kinsella presents a complete and living version of the story. His translation is based on the partial texts in two medieval manuscripts, with eleme..."
mythology,9780140449198,0140449191,The Epic of Gilgamesh,,,2003-04-29,https://books.google.com/books/about/The_Epic_of_Gilgamesh.html?hl=&id=eCZRK_61adMC,9780140449198,"Epic poetry, Assyro-Babylonian, Translations into English, Gilgamesh",http://books.google.com/books/content?id=eCZRK_61adMC&printsec=frontcover&img=1&zoom=1&edge=curl&source=gbs_api,"Andrew George's ""masterly new translation"" (The Times) of the world's first truly great work of literature A Penguin Classic Miraculously preserved on clay tablets dating back as much as four thousand years, the poem of Gilgamesh, king of Uruk, is the world’s oldest epic, predating Homer by many centuries. The story tells of Gilgamesh’s adventures with the wild man Enkidu, and of his arduous journey to the ends of the earth in quest of the Babylonian Noah and the secret of immortality. Alongside its themes of family, friendship and the duties of kings, the Epic of Gilgamesh is, above all, about mankind’s eternal struggle with the fear of death. The Babylonian version has been known for over a century, but linguists are still deciphering new fragments in Akkadian and Sumerian. Andrew George’s gripping translation brilliantly combines these into a fluent narrative and will long rank as the definitive English Gilgamesh. For more than seventy years, Penguin has been the leading publisher of classic literature in the English-speaking world. With more than 1,700 titles, Penguin Classics represents a global bookshelf of the best works throughout history and across genres and disciplines. Readers trust the series to provide authoritative texts enhanced by introductions and notes by distinguished scholars and contemporary authors, as well as up-to-date translations by award-winning translators."
horror,9780760779804,0760779805,The Demon Hunter's Handbook,,,2006,https://books.google.com/books/about/The_Demon_Hunter_s_Handbook.html?hl=&id=IxklAAAACAAJ,9780760779804,Vampires,,
cookbook,9789607439499,960743949X,Greek Cookery,300 Traditional Recipes,,2006-09-01,https://books.google.com/books/about/Greek_Cookery.html?hl=&id=DOS0tgAACAAJ,9789607439499,,,
cookbook,9780615332994,0615332994,Colorado Potato Cookbook,Irresistible Potato Creations,,2008,https://books.google.com/books/about/Colorado_Potato_Cookbook.html?hl=&id=F3B1AQAACAAJ,9780615332994,Cooking (Potatoes),,
cookbook,9781412745420,141274542X,Best of the Best Smoothies,,,2009,https://books.google.com/books/about/Best_of_the_Best_Smoothies.html?hl=&id=gbuTQwAACAAJ,9781412745420,"Blenders (Cooking), Smoothies (Beverages), Fruit drinks",http://books.google.com/books/content?id=gbuTQwAACAAJ&printsec=frontcover&img=1&zoom=1&source=gbs_api,"Looking for the best cool and creamy smoothies? Here you'll find more than 150 delicious drink recipes for entertaining and simple every day pleasures. Tempt your taste buds with recipes made with citrus, berries, chocolate, coffee, tea, yogurt, ice cream and so much more! Browse through the five chapters--Berry Good, Tropical Temptations, Shake It Up, Healthy Sips and Drinkable Dessert--to find all your favorite mouthwatering beverages. So what are you waiting for? Grab a blender and start sipping in style! Best of the Best Smoothies contains 60 tantalizing full page color photos."
cookbook,9781407562636,1407562630,Cooking School Indian,Bring the Flavors of India to Life in Your Own Kitchen!.,,2009,https://books.google.com/books/about/Cooking_School_Indian.html?hl=&id=E_WK0AEACAAJ,9781407562636,,,
cookbook,9781445430577,1445430576,Pasta,,,2011-05,https://books.google.com/books/about/Pasta.html?hl=&id=9OGzoQEACAAJ,9781445430577,Cooking,http://books.google.com/books/content?id=9OGzoQEACAAJ&printsec=frontcover&img=1&zoom=1&source=gbs_api,"This fully illustrated recipe collection in a handy chunky format is sure to become your go-to guide for cooking delicious pasta meals. Ideal for those just getting started in the kitchen, this easy recipe set with step-by-step instructions will help you turn out perfect appetizers, light meals, and filling main dishes. From our Cooking Made Simple collection."
mythology,9781435155930,1435155939,Irish Fairy and Folk Tales,,,2015-01-15,https://books.google.com/books/about/Irish_Fairy_and_Folk_Tales.html?hl=&id=tykjrgEACAAJ,9781435155930,Fairy tales,http://books.google.com/books/content?id=tykjrgEACAAJ&printsec=frontcover&img=1&zoom=1&source=gbs_api,
fantasy,9781501127144,1501127144,Magic Soup,100 Recipes for Health and Happiness,"Nicole Pisani, Kate Adams",2015-11-10,https://play.google.com/store/books/details?id=qrlvCQAAQBAJ,"{'title': 'Magic Soup', 'subtitle': '100 Recipes for Health and Happiness', 'authors': ['Nicole Pisani', 'Kate Adams'], 'publisher': 'Simon and Schuster', 'publishedDate': '2015-11-10', 'description': 'More than one hundred delicious and nutritious soups that boast a unique blend of fresh ingredients and surprising spice and flavor combinations—ideal for losing weight, detoxing, or satisfying a craving for comfort—from the former head chef of Yotam Ottolenghi’s renowned restaurant NOPI. There is something special about soup—it has the ability to revitalize and to soothe. A really good bowl of soup puts you in a positive frame of mind and nourishes your body—and it can be the perfect way to jumpstart weight loss. In this gorgeous four-color, fully illustrated book, Nicole Pisani and Kate Adams show that soup is a recipe for health and happiness. Magic Soup is a mouth-watering collection of more than one hundred innovative recipes for stocks and stews, hearty meals, healing bone broths, a detoxifying soup cleanse, and more. Recipes such as salmon poached in lemongrass tea, lemon chicken and mint with quinoa, and the ultimate “chicken soup for the soul” prove that soup can be a filling meal in itself. There’s drool-worthy butternut squash with caramelized pear; delicious beetroot and burrata; and a robust Swedish sailors’ soup made from beef and beer. In warmer months, cool down with watermelon gazpacho and fennel vichyssoise. And get healthy with nettle soup with flowers, a miso soup for each season, and the book’s namesake restorative magic soup of turmeric, ginger, cardamom, cayenne, cinnamon, cumin, spinach, and seeds. Whether you’re swapping a stale sandwich for a vibrant bowl of grains and greens, relaxing over a velvety blend of manuka-honeyed parsnip, cooking rib-eye pho for a feast, or nursing a cold with an Ayurvedic garlic blend—it’s always the right time for soup.', 'industryIdentifiers': [{'type': 'ISBN_13', 'identifier': '9781501127144'}, {'type': 'ISBN_10', 'identifier': '1501127144'}], 'readingModes': {'text': True, 'image': False}, 'pageCount': 383, 'printType': 'BOOK', 'categories': ['Cooking'], 'maturityRating': 'NOT_MATURE', 'allowAnonLogging': True, 'contentVersion': '1.9.8.0.preview.2', 'panelizationSummary': {'containsEpubBubbles': False, 'containsImageBubbles': False}, 'imageLinks': {'smallThumbnail': 'http://books.google.com/books/content?id=qrlvCQAAQBAJ&printsec=frontcover&img=1&zoom=5&edge=curl&source=gbs_api', 'thumbnail': 'http://books.google.com/books/content?id=qrlvCQAAQBAJ&printsec=frontcover&img=1&zoom=1&edge=curl&source=gbs_api'}, 'language': 'en', 'previewLink': 'http://books.google.com/books?id=qrlvCQAAQBAJ&printsec=frontcover&dq=title:magic+soup+inauthor:nicole+pisani&hl=&cd=1&source=gbs_api', 'infoLink': 'https://play.google.com/store/books/details?id=qrlvCQAAQBAJ&source=gbs_api', 'canonicalVolumeLink': 'https://play.google.com/store/books/details?id=qrlvCQAAQBAJ'}","Reducing diets, Soups",http://books.google.com/books/content?id=qrlvCQAAQBAJ&printsec=frontcover&img=1&zoom=1&edge=curl&source=gbs_api,"More than one hundred delicious and nutritious soups that boast a unique blend of fresh ingredients and surprising spice and flavor combinations—ideal for losing weight, detoxing, or satisfying a craving for comfort—from the former head chef of Yotam Ottolenghi’s renowned restaurant NOPI. There is something special about soup—it has the ability to revitalize and to soothe. A really good bowl of soup puts you in a positive frame of mind and nourishes your body—and it can be the perfect way to jumpstart weight loss. In this gorgeous four-color, fully illustrated book, Nicole Pisani and Kate Adams show that soup is a recipe for health and happiness. Magic Soup is a mouth-watering collection of more than one hundred innovative recipes for stocks and stews, hearty meals, healing bone broths, a detoxifying soup cleanse, and more. Recipes such as salmon poached in lemongrass tea, lemon chicken and mint with quinoa, and the ultimate “chicken soup for the soul” prove that soup can be a filling meal in itself. There’s drool-worthy butternut squash with caramelized pear; delicious beetroot and burrata; and a robust Swedish sailors’ soup made from beef and beer. In warmer months, cool down with watermelon gazpacho and fennel vichyssoise. And get healthy with nettle soup with flowers, a miso soup for each season, and the book’s namesake restorative magic soup of turmeric, ginger, cardamom, cayenne, cinnamon, cumin, spinach, and seeds. Whether you’re swapping a stale sandwich for a vibrant bowl of grains and greens, relaxing over a velvety blend of manuka-honeyed parsnip, cooking rib-eye pho for a feast, or nursing a cold with an Ayurvedic garlic blend—it’s always the right time for soup."
comicbook,9781950912544,195091254X,SPACE PIRATE CAPTAIN HARLOCK,,"Leiji Matsumoto, Jerome Alquie",2022-02-23,https://books.google.com/books/about/SPACE_PIRATE_CAPTAIN_HARLOCK.html?hl=&id=wbiLzgEACAAJ,9781950912544,"Fiction, action & adventure",http://books.google.com/books/content?id=wbiLzgEACAAJ&printsec=frontcover&img=1&zoom=1&source=gbs_api,"From the legendary Leiji Matsumoto, along with Jerome Alquie, comes an epic new story! Set within the timeline of the original series, this brand-new Captain Harlock adventure marks the beginning of a new story arc. Planet Earth is threatened by an upcoming invasion by the Mazon and despite being banished as a pirate, Captain Harlock won't give up trying to save the world. This time, the source of danger comes directly from Earth, not outer space. A team of scientists discovers a Mazon mausoleum where they find information about terrifying genetic manipulations and a destructive power capable of either providing the Mazon with immortality or putting an end to their civilization. The unprecedented cold spell hitting Earth might only be a taste of what this new enemy has in store... Will Captain Harlock and his crew manage to solve this mystery and save the Earth from yet another menace? Bonus - Includes behind the scenes sketches, designs, art and photos on the creation of the story. Also contains a complete cover gallery!"
mythology,9781645174424,1645174425,Recipes from the World of Tolkien,Inspired by the Legends,Robert Tuesley Anderson,2020-10-13,https://books.google.com/books/about/Recipes_from_the_World_of_Tolkien.html?hl=&id=pNstEAAAQBAJ,9781645174424,Cooking,http://books.google.com/books/content?id=pNstEAAAQBAJ&printsec=frontcover&img=1&zoom=1&edge=curl&source=gbs_api,"If you've ever wondered what a hobbit, an elf, or a dwarf might eat in a day's meals, this cookbook is for you! Whip up some tasty fare with recipes that cover all six mealtimes from the realm of J.R.R. Tolkien. Divided by the time of day, these recipes use modern ingredients and culinary techniques, and American measurements"
sci-fi,9780553293357,0553293354,Foundation,,Isaac Asimov,1991-10-01,https://books.google.com/books/about/Foundation.html?hl=&id=Gf6NEAAAQBAJ,9780553293357,"Psychohistory, Open Library Staff Picks, Life on other planets, Fiction, Science Fiction, Long Now Manual for Civilization, Prophecy, Historians, Robots, Fiction, science fiction, general, American literature, American Fantasy fiction, Vie extraterrestre, Romans, nouvelles, Psychohistoire, Psychological fiction, American Science fiction, Hari Seldon (Fictitious character)",http://books.google.com/books/content?id=Gf6NEAAAQBAJ&printsec=frontcover&img=1&zoom=1&source=gbs_api,"The first novel in Isaac Asimov’s classic science-fiction masterpiece, the Foundation series THE EPIC SAGA THAT INSPIRED THE APPLE TV+ SERIES FOUNDATION • Nominated as one of America’s best-loved novels by PBS’s The Great American Read For twelve thousand years the Galactic Empire has ruled supreme. Now it is dying. But only Hari Seldon, creator of the revolutionary science of psychohistory, can see into the future—to a dark age of ignorance, barbarism, and warfare that will last thirty thousand years. To preserve knowledge and save humankind, Seldon gathers the best minds in the Empire—both scientists and scholars—and brings them to a bleak planet at the edge of the galaxy to serve as a beacon of hope for future generations. He calls his sanctuary the Foundation. The Foundation novels of Isaac Asimov are among the most influential in the history of science fiction, celebrated for their unique blend of breathtaking action, daring ideas, and extensive worldbuilding. In Foundation, Asimov has written a timely and timeless novel of the best—and worst—that lies in humanity, and the power of even a few courageous souls to shine a light in a universe of darkness."
sci-fi,9780553293401,0553293400,The Caves of Steel,,Isaac Asimov,1991-11-01,https://books.google.com/books/about/The_Caves_of_Steel.html?hl=&id=I_6NEAAAQBAJ,9780553293401,"Robots, Fiction, Fiction, science fiction, hard science fiction, Fiction, mystery & detective, general, Interplanetary voyages, Murder, American literature, American Science fiction, Science fiction, Overpopulation",http://books.google.com/books/content?id=I_6NEAAAQBAJ&printsec=frontcover&img=1&zoom=1&source=gbs_api,"A millennium into the future two advancements have altered the course of human history: the colonization of the galaxy and the creation of the positronic brain. Isaac Asimov’s Robot novels chronicle the unlikely partnership between a New York City detective and a humanoid robot who must learn to work together. Like most people left behind on an over-populated Earth, New York City police detective Elijah Baley had little love for either the arrogant Spacers or their robotic companions. But when a prominent Spacer is murdered under mysterious circumstances, Baley is ordered to the Outer Worlds to help track down the killer. The relationship between Life and his Spacer superiors, who distrusted all Earthmen, was strained from the start. Then he learned that they had assigned him a partner: R. Daneel Olivaw. Worst of all was that the “R” stood for robot—and his positronic partner was made in the image and likeness of the murder victim!"
sci-fi,9780393972412,0393972410,The Norton Book of Science Fiction,"North American Science Fiction, 1960-1990","Ursula K. Le Guin, Brian Attebery",1993,https://books.google.com/books/about/The_Norton_Book_of_Science_Fiction.html?hl=&id=Q6QJNQEACAAJ,9780393972412,"Science fiction, American, American Science fiction, Fiction, science fiction, general, Science fiction, Short stories, Science-Fiction-Literatur, Science-Fiction, Science-fiction américaine, Umschulungswerkstätten für Siedler und Auswanderer",http://books.google.com/books/content?id=Q6QJNQEACAAJ&printsec=frontcover&img=1&zoom=1&source=gbs_api,"A collection of sixty-seven contemporary American science fiction stories includes contributions by Poul Anderson, Margaret Atwood, Octavia Butler, Samuel R. Delany, and Philip K. Dick"
nonfiction,9781542726276,1542726271,Un-Making a Murderer,The Framing of Steven Avery and Brendan Dassey,Shaun Attwood,2017,https://books.google.com/books/about/Un_Making_a_Murderer.html?hl=&id=f6gzMQAACAAJ,9781542726276,Judicial error,http://books.google.com/books/content?id=f6gzMQAACAAJ&printsec=frontcover&img=1&zoom=1&source=gbs_api,"""Finally, an amazingly honest book that details exactly how my brother was set up"" - Brad Dassey Innocent people do go to jail. Sometimes mistakes are made. But even more terrifying is when the authorities conspire to frame them. That's what happened to Steven Avery and Brendan Dassey, who were convicted of murder and are serving life sentences. Un-Making a Murderer is an explosive book which uncovers the illegal, devious and covert tactics used by Wisconsin officials, including: Concealing Other Suspects Paying Expert Witnesses to Lie Planting Evidence Jury Tampering The art of framing innocent people has been in practice for centuries and will continue until the perpetrators are held accountable. Turning conventional assumptions and beliefs in the justice system upside down, Un-Making a Murderer takes you on that journey. The profits from this book are going to Steven and Brendan and to donate free books to schools and prisons. In the last two years, Shaun Attwood has donated 15,000 books."
cookbook,9781849756549,1849756546,The Scandi Kitchen,"Simple, delicious dishes for any occasion",Bronte Aurell,2015-09-10,https://books.google.com/books/about/The_Scandi_Kitchen.html?hl=&id=xuPvrQEACAAJ,9781849756549,"Cooking, scandinavian, Psychology",http://books.google.com/books/content?id=xuPvrQEACAAJ&printsec=frontcover&img=1&zoom=1&source=gbs_api,"This accessible and entertaining introduction to Scandinavian food contains over 80 recipes to try at home, developed by Bronte Aurell, owner of the popular ScandiKitchen Cafe in London’s bustling West End. This accessible and entertaining introduction to Scandinavian food contains over 80 recipes to try at home, developed by Bronte Aurell, owner of the popular ScandiKitchen Cafe in London’s bustling West End. There’s so much more to Nordic food than pickled herring and meatballs. Stretching from the midnight sun of northern Norway to the flat, fertile fields of Denmark, Scandinavian food culture is a lot more varied than you might think. Dishes and ingredients link all the regions together, bringing a uniquely Nordic food experience to life that was created by thousands of years of heritage and shared culture. Scandinavian food is simple. Natives call it ‘husmanskost’ (farmer’s fare). It’s natural and honest. When you work with the very best produce, there’s no need to overcomplicate it. Its appeal lies in the fact that it is healthy, wholesome, flavorsome, simple to make and beautiful to look at. This book features recipes for all occasions and times of the day, ranging from morning buns, lunchtime savories, hearty dinners, and indulgent desserts, to bakes and other foods for special celebrations. Enjoy fresh and simple open sandwiches, healthy Nordic salads, delicious traditional hot dishes, and indulgent cakes. Discover new flavors and textures from mustard pickled herring and gravlax to sticky Kladdkaka cake."
mythology,9781250886088,1250886082,Legends & Lattes,A Novel of High Fantasy and Low Stakes,Travis Baldree,2022-11-08,https://books.google.com/books/about/Legends_Lattes.html?hl=&id=sGJzEAAAQBAJ,9781250886088,"Fiction, fantasy, general, nyt:trade-fiction-paperback=2022-11-27, New York Times bestseller",http://books.google.com/books/content?id=sGJzEAAAQBAJ&printsec=frontcover&img=1&zoom=1&source=gbs_api,"""The much-beloved BookTok sensation from Travis Baldree, Legends & Lattes is a novel of high fantasy and low stakes. *The new paperback edition will include a very special, never-before-seen bonus story, 'Pages to Fill.'* Come take a load off at Viv's cafe, the first & only coffee shop in Thune. Grand opening! Worn out after decades of packing steel and raising hell, Viv, the orc barbarian, cashes out of the warrior's life with one final score. A forgotten legend, a fabled artifact, and an unreasonable amount of hope lead her to the streets of Thune, where she plans to open the first coffee shop the city has ever seen. However, her dreams of a fresh start filling mugs instead of swinging swords are hardly a sure bet. Old frenemies and Thune's shady underbelly may just upset her plans. To finally build something that will last, Viv will need some new partners, and a different kind of resolve. ""Take a break from epic battles and saving the world. Legends & Lattes is a wholesome, cozy novel that feels like a warm hug. This is my new comfort read.""-Genevieve Gornichec, author of The Witch's Heart""--"
sci-fi,9781250819994,1250819997,Dead Silence,,S.A. Barnes,2022-02-08,https://books.google.com/books/about/Dead_Silence.html?hl=&id=oI8oEAAAQBAJ,9781250819994,"Horror, Science Fiction, Fiction, Thriller, Mystery, Space, Fantasy, Mystery Thriller",http://books.google.com/books/content?id=oI8oEAAAQBAJ&printsec=frontcover&img=1&zoom=1&source=gbs_api,"A GHOST SHIP.A SALVAGE CREW.UNSPEAKABLE HORRORS.Claire Kovalik is days away from being unemployed--made obsolete--when her beacon repair crew picks up a strange distress signal. With nothing to lose and no desire to return to Earth, Claire and her team decide to investigate. What they find at the other end of the signal is a shock: the Aurora, a famous luxury space-liner that vanished on its maiden tour of the solar system more than twenty years ago. A salvage claim like this could set Claire and her crew up for life. But a quick trip through the Aurora reveals something isn't right. Whispers in the dark. Flickers of movement. Words scrawled in blood. Claire must fight to hold onto her sanity and find out what really happened on the Aurora, before she and her crew meet the same ghastly fate."
