Genre,ISBN-13,ISBN-10,Title,Subtitle,Author,Publish Date,URL,Scanned Input,Tags,Thumbnail,Description
horror,9780593201268,0593201264,How to Sell a Haunted House,,Grady Hendrix,2023-01-17,https://books.google.com/books/about/How_to_Sell_a_Haunted_House.html?hl=&id=xiuTEAAAQBAJ,9780593201268,"Fiction, horror, Ghosts, Thriller, Paranormal, Mystery, Death of a Parent, Horror, Fiction, Mystery Thriller, Contemporary",http://books.google.com/books/content?id=xiuTEAAAQBAJ&printsec=frontcover&img=1&zoom=1&source=gbs_api,"AN INSTANT NEW YORK TIMES BESTSELLER ""Wildly entertaining.""-The New York Times ""Ingenious.""-The Washington Post New York Times bestselling author Grady Hendrix takes on the haunted house in a thrilling new novel that explores the way your past—and your family—can haunt you like nothing else. When Louise finds out her parents have died, she dreads going home. She doesn’t want to leave her daughter with her ex and fly to Charleston. She doesn’t want to deal with her family home, stuffed to the rafters with the remnants of her father’s academic career and her mother’s lifelong obsession with puppets and dolls. She doesn’t want to learn how to live without the two people who knew and loved her best in the world. Most of all, she doesn’t want to deal with her brother, Mark, who never left their hometown, gets fired from one job after another, and resents her success. Unfortunately, she’ll need his help to get the house ready for sale because it’ll take more than some new paint on the walls and clearing out a lifetime of memories to get this place on the market. But some houses don’t want to be sold, and their home has other plans for both of them… Like his novels The Southern Book Club’s Guide to Slaying Vampires and The Final Girl Support Group, How to Sell a Haunted House is classic Hendrix: equal parts heartfelt and terrifying—a gripping new read from “the horror master” (USA Today)."
fantasy,9780593953334,0593953339,The Ghost Tree,,Christina Henry,2025-08-26,https://books.google.com/books/about/The_Ghost_Tree.html?hl=&id=NaA3EQAAQBAJ,9780593953334,"Horror, Fantasy, Mystery, Fiction, Young Adult, Paranormal, Thriller, Supernatural, Witches, American literature",http://books.google.com/books/content?id=NaA3EQAAQBAJ&printsec=frontcover&img=1&zoom=1&edge=curl&source=gbs_api,"When people go missing in the sleepy town of Smith’s Hollow, the only clue to their fate comes when a teenager starts having terrifying visions, in a chilling horror novel from national bestselling author Christina Henry. When the bodies of two girls are found torn apart in the town of Smiths Hollow, Lauren is surprised, but she also expects that the police won't find the killer. After all, the year before her father's body was found with his heart missing, and since then everyone has moved on. Even her best friend, Miranda, has become more interested in boys than in spending time at the old ghost tree, the way they used to when they were kids. So when Lauren has a vision of a monster dragging the remains of the girls through the woods, she knows she can't just do nothing. Not like the rest of her town. But as she draws closer to answers, she realizes that the foundation of her seemingly normal town might be rotten at the center. And that if nobody else stands for the missing, she will."
horror,9781250780935,1250780934,HEX,,Thomas Olde Heuvelt,2021-09-21,https://books.google.com/books/about/HEX.html?hl=&id=vmkTzgEACAAJ,9781250780935,"Haunted places, Witches, Fiction, Fiction, horror, Dutch fiction, Translations into English, Witches - Fiction, Historical fiction, Horror tales",http://books.google.com/books/content?id=vmkTzgEACAAJ&printsec=frontcover&img=1&zoom=1&source=gbs_api,"“This is totally, brilliantly original.” —Stephen King “HEX is creepy and gripping and original, sure to be one of the top horror novels of 2016.” —George R.R. Martin The English language debut of the bestselling Dutch novel, Hex, from Thomas Olde Heuvelt--a Hugo and World Fantasy award nominated talent to watch Whoever is born here, is doomed to stay 'til death. Whoever settles, never leaves. Welcome to Black Spring, the seemingly picturesque Hudson Valley town haunted by the Black Rock Witch, a seventeenth century woman whose eyes and mouth are sewn shut. Muzzled, she walks the streets and enters homes at will. She stands next to children's bed for nights on end. Everybody knows that her eyes may never be opened or the consequences will be too terrible to bear. The elders of Black Spring have virtually quarantined the town by using high-tech surveillance to prevent their curse from spreading. Frustrated with being kept in lockdown, the town's teenagers decide to break their strict regulations and go viral with the haunting. But, in so doing, they send the town spiraling into dark, medieval practices of the distant past. This chilling novel heralds the arrival of an exciting new voice in mainstream horror and dark fantasy."
horror,9781250759597,1250759595,Oracle,,Thomas Olde Heuvelt,2025-04,https://books.google.com/books/about/Oracle.html?hl=&id=HKYWEQAAQBAJ,9781250759597,Fiction,http://books.google.com/books/content?id=HKYWEQAAQBAJ&printsec=frontcover&img=1&zoom=1&source=gbs_api,"From international bestseller Thomas Olde Heuvelt comes Oracle, a supernatural thriller where an omen from our past threatens the return of ancient forces that will change the world forever. ""The threshold to the apocalypse has seldom been so fun. This is Olde Heuvelt’s sharpest, most compelling work to date.”—The New York Times On a foggy winter morning, high school kids Luca and Emma discover the impossible: the wreck of an eighteenth-century ship stranded in a flower field. Emma enters the hatch on the deck and is never seen again. And she isn’t the last to disappear. . . . Soon a government agency begins to investigate, determined to uncover the ship’s secrets before a media storm erupts. They enlist Robert Grim, a retired specialist of the occult, to unravel the mystery, and he soon realizes the ship could be a harbinger of an ancient doom awakened under the sea. In a maelstrom of international intrigue and pure terror, Grim and Luca must race against time as they come face-to-face with an open doorway to the apocalypse."
nonfiction,9780465026562,0465026567,"Godel, Escher, Bach",An Eternal Golden Braid,Douglas R. Hofstadter,1999-02-05,https://books.google.com/books/about/Godel_Escher_Bach.html?hl=&id=izy9Tg6rmb8C,9780465026562,"Logics, Teoria Do Conhecimento, Artificial intelligence, Metamathematics, Symmetry, Mathematics, Open Library Staff Picks, Symbolic and mathematical Logic, Long Now Manual for Civilization, Kognitiver Prozess, Metamathematik, Computer, Künstliche Intelligenz, Weltbild, Simetrâi, Reading Level-Grade 7, Reading Level-Grade 9, Reading Level-Grade 8, Reading Level-Grade 11, Reading Level-Grade 10, Reading Level-Grade 12, maths, music, complexity, Goedel, kurt, 1906-1978, Escher, m. c. (maurits cornelis), 1898-1970, Bach, johann sebastian, 1685-1750, Escher, M. C. (Maurits Cornelis), 1898-1972, Gödel, Kurt, Matematica, Logica, Inteligencia Artificial (Computacao), Simetría, Inteligencia artificial, Metamathematica, Mathématiques, Symétrie, Intelligence artificielle, Philosophy, Bach, johann sebastian , 1685-1750, Escher, m. c. (maurits cornelis) , 1898-1972, Qa9.8 .h63 1999",http://books.google.com/books/content?id=izy9Tg6rmb8C&printsec=frontcover&img=1&zoom=1&source=gbs_api,"Winner of the Pulitzer Prize A metaphorical fugue on minds and machines in the spirit of Lewis Carroll Douglas Hofstadter's book is concerned directly with the nature of ""maps"" or links between formal systems. However, according to Hofstadter, the formal system that underlies all mental activity transcends the system that supports it. If life can grow out of the formal chemical substrate of the cell, if consciousness can emerge out of a formal system of firing neurons, then so too will computers attain human intelligence. Gödel, Escher, Bach is a wonderful exploration of fascinating ideas at the heart of cognitive science: meaning, reduction, recursion, and much more."
cookbook,9781621458289,1621458288,Taste of Home Fall Baking,"275+ Breads, Pies, Cookies & More",Taste of Home,2022-09-13,https://books.google.com/books/about/Taste_of_Home_Fall_Baking.html?hl=&id=42TvzgEACAAJ,9781621458289,Cooking,http://books.google.com/books/content?id=42TvzgEACAAJ&printsec=frontcover&img=1&zoom=1&source=gbs_api,"Savor all of your fall favorites with autumn's best baked goods in this collection of more than 275+ mouthwatering recipes. Inside you’ll find more than 275+ impressive cakes, snackable cookies, holiday pies, impressive tarts and all the buttery breads you adore most. You’ll also rely on dozens of how-to photos and step-by-step instructions as well as baking hints and tips from our Test Kitchen pros. Additional QR codes link you to handy how-to videos and collections of free recipes. A special Bonus Chapter offers savory potpies, bubbling casseroles and other oven-fresh entrees sure to warm the chilliest fall evening. Autumn is the perfect time of year to bake up a sensational new favorite. Let this keepsake cookbook show you how. CHAPTERS Favorite Fall Ingredients All-Time Fall Favorites Classic Yeast Breads Quick Breads Cookies, Brownies & Bars Pies & Tarts Cakes & Cupcakes Pastries & Bakeshop Sweets Autumn’s Best Desserts Bonus: Pot Pies & Other Cozy Dinners Index by Flavor/Ingredient Index by Recipe Title RECIPES Apple Brandy Pecan Cake Apple Cider Cinnamon Rolls Nantucket Cranberry Tart Chocolate Chip Pumpkin Bread Wholesome Wheat Bread Rosemary Walnut Bread Maple Chai Pumpkin Muffins Dumpling Pull-Apart Bread Best-Ever Breadsticks Cheese & Garlic Biscuits Sweet Potato Dutch Baby with Praline Syrup Almond Chocolate Biscotti Apple Butter Pumpkin Pie Brie & Caramelized Onion Flatbread Date-Walnut Pinwheels Frosted Maple Cookies Rustic Nut Bars Honey Pecan Cheesecake Ginger Pumpkin Cheesecake Toffee-Pear Crisp Bread Pudding Mile-High Chicken Potpie Beef & Blue Cheese Tart Buffalo Chicken Crescent Rolls Turkey Lattice Pie Beef Stew Skillet Pie"
classic,9781785996092,1785996096,The Iliad,,Homer,2016-07-15,https://books.google.com/books/about/The_Iliad.html?hl=&id=l69r0AEACAAJ,9781785996092,,http://books.google.com/books/content?id=l69r0AEACAAJ&printsec=frontcover&img=1&zoom=1&source=gbs_api,
mythology,9781785996153,1785996150,Classics The Odyssey,,Homer,2016-08-15,https://books.google.com/books/about/Classics_The_Odyssey.html?hl=&id=1oC9jwEACAAJ,9781785996153,"Greek Epic poetry, Translations into English, Poetry, Classical Epic poetry, Translations",,
cookbook,9780873588560,0873588568,Southwest Slow Cooking,,"Tammy Biber, Theresa Howell",2004-09-15,https://books.google.com/books/about/Southwest_Slow_Cooking.html?hl=&id=74gNAAAACAAJ,9780873588560,"American Cooking, Southwestern style, Slow Electric cooking, Slow Electric cookery, Cooking, american, southwestern style, Electric cooking, slow",http://books.google.com/books/content?id=74gNAAAACAAJ&printsec=frontcover&img=1&zoom=1&source=gbs_api,"In the quarter-century since cookers appeared in kitchens from coast to coast, there has never been such a flavorful collection of recipes. Included is an invaluable guide to the Southwest kitchen with hints for stocking your own pantry, as well as tips and suggestions on using your slow cooker, allowing you to make dinner and get on with your life. Authors Tammy Biber and Theresa Howell compiled their favorite recipes including traditional specialties such as Tortilla Soup, Mole, Carnitas, and Machaca and blended them with new flavors like Pork Chops with Raspberry-Chipotle Sauce and Corned Beef Enchiladas. Healthy, flavorful food is brought back to life in this old-school kitchen appliance, so fill your slow cooker with these delicious meals that are ready when you are."
fitness,9780934641616,0934641617,Front Range Crags,,Peter Hubbel,1993-12-01,https://books.google.com/books/about/Front_Range_Crags.html?hl=&id=RU2xAAAACAAJ,"{'title': 'Front Range Crags', 'authors': ['Peter Hubbel'], 'publisher': 'Falcon Guides', 'publishedDate': '1993-12-01', 'industryIdentifiers': [{'type': 'ISBN_10', 'identifier': '0934641617'}, {'type': 'ISBN_13', 'identifier': '9780934641616'}], 'readingModes': {'text': False, 'image': False}, 'pageCount': 279, 'printType': 'BOOK', 'categories': ['Mountaineering'], 'maturityRating': 'NOT_MATURE', 'allowAnonLogging': False, 'contentVersion': 'preview-1.0.0', 'language': 'en', 'previewLink': 'http://books.google.com/books?id=RU2xAAAACAAJ&dq=title:front+range+crags+inauthor:peter+hubbel&hl=&cd=1&source=gbs_api', 'infoLink': 'http://books.google.com/books?id=RU2xAAAACAAJ&dq=title:front+range+crags+inauthor:peter+hubbel&hl=&source=gbs_api', 'canonicalVolumeLink': 'https://books.google.com/books/about/Front_Range_Crags.html?hl=&id=RU2xAAAACAAJ'}",,,
fantasy,9780375757402,0375757406,The Turn of the Screw & In the Cage,,Henry James,2001-05-08,https://books.google.com/books/about/The_Turn_of_the_Screw_In_the_Cage.html?hl=&id=B0KWcFEqARcC,9780375757402,"Governesses, fiction, Children, fiction, Fiction, ghost, Fiction, fantasy, London (England), fiction, Social conditions, James, Henry , Ps2116 .t8 2010, 813.4, Fiction, horror, , Readers, Ghost stories, British and Irish fiction (fictional works by one author), American fiction (fictional works by one author), German, Dictionaries, English language, French, Large type books, Governesses -- England -- Fiction, Children -- England -- Fiction, England -- Fiction, England, Orphans, Literature and fiction (general), Governesses in literature,, England, fiction, ,, psychological, , Classics, Governesses--Fiction, Children--Fiction, England--Fiction, Children in fiction, England in fiction, Fathers and daughters, Telegraphers, Textbooks for foreign speakers, Young women, Supernatural, Romance Norte Americano, Correspondence, Business Men's Art Club of New York, United States. Bureau of Labor Statistics, Statistics, Business Men's Art Club of San Francisco, Diseases, Business Men's Art Club of Chicago, Cost and standard of living, Air, United States, Pacific Coast Borax Company, Occupational mortality, Cost of Medical care, Purchasing power, Medical statistics, Pollution, Criticism and interpretation, Manners and customs, Social life and customs, Psychological fiction, Americans, American literature,, Man-woman relationships, , Romance fiction, Domestic fiction,, short stories (single author), , American fiction, English fiction, New York Times reviewed, Literary criticism,, Turn of the screw (James, Henry), James, Henry, 1843-1916, American fiction, history and criticism, 19th century, , Ps2116 .t8 1998, 813/.4, Children's fiction, Korean, Gouvernantes,, Romans, nouvelles, , Enfants, High interest-low vocabulary books,, Adventure and adventurers, Long Now Manual for Civilization, Governesses, Governesses in literature, Children, Romance Norte Americano, Supernatural, Fathers and daughters, Young women, Domestic fiction, Romance fiction, Ghost stories, Telegraphers, Fiction, general",http://books.google.com/books/content?id=B0KWcFEqARcC&printsec=frontcover&img=1&zoom=1&edge=curl&source=gbs_api,"This Modern Library Paperback Classics edition brings together one of literature's most famous ghost stories and one of Henry James's most unusual novellas. In The Turn of the Screw, a governess is haunted by ghosts from her young charges past; Virginia Woolf said of this masterpiece of psychological ambiguity and suggestion, We are afraid of something unnamed, of something, perhaps, in ourselves...Henry James...can still make us afraid of the dark. In his rarely anthologized novella In the Cage, James brings his incomparable powers of observation to the story of a clever, rebellious heroine of Britain's lower middle class. Hortense Calisher, in her Introduction, calls it a delicious story, the more so because it confounds what we expect from James."
cookbook,9780811833875,0811833879,The New Irish Table,70 Contemporary Recipes,Margaret M. Johnson,2003,https://books.google.com/books/about/The_New_Irish_Table.html?hl=&id=NDcVs0S42qMC,9780811833875,"Irish Cookery, Irish Cooking, Cooking, irish",http://books.google.com/books/content?id=NDcVs0S42qMC&printsec=frontcover&img=1&zoom=1&edge=curl&source=gbs_api,"Presents recipes and cooking instructions for updated versions of traditional Irish fare, and provides photographs of both the food and scenic portraits of Ireland."
fantasy,9780064472685,006447268X,The Chronicles of Chrestomanci,,Diana Wynne Jones,2001-01-09,https://books.google.com/books/about/The_Chronicles_of_Chrestomanci.html?hl=&id=GOG5mDr75gAC,006447268x,Juvenile Fiction,http://books.google.com/books/content?id=GOG5mDr75gAC&printsec=frontcover&img=1&zoom=1&edge=curl&source=gbs_api,"In this multiple parallel universes of the Twelve Related Worlds, only an enchanter with nine lives is powerful enough to control the rampant misuse of magic--and to hold the title Chrestomanci... The Chants are a family strong in magic, but neither Christopher Chant nor Cat Chant can work even the simplest of spells. Who could have dreamed that both Christopher and Cat were born with nine lives--or that they could lose them so quickly?"
mystery,9780760791028,0760791023,Uncovering Jack the Ripper's London,,Richard Jones,2007,https://books.google.com/books/about/Uncovering_Jack_the_Ripper_s_London.html?hl=&id=1WGqQwAACAAJ,9780760791028,"Jack the Ripper Murders, London, England, 1888",,
horror,9781982137649,1982137649,My Heart Is a Chainsaw,,Stephen Graham Jones,2022-03-29,https://books.google.com/books/about/My_Heart_Is_a_Chainsaw.html?hl=&id=vOdhEAAAQBAJ,9781982137649,"American literature, Horror films, Fiction, Psychic trauma, Teenage girls, Abused children, Revenge, Films d'horreur, Romans, nouvelles, Traumatisme psychique, Adolescentes, Vengeance, Horror, Thriller, Mystery, Indigenous, Mystery Thriller, Horror Thriller, Contemporary",http://books.google.com/books/content?id=vOdhEAAAQBAJ&printsec=frontcover&img=1&zoom=1&edge=curl&source=gbs_api,"Protected by horror movies -- especially the ones where the masked killer seeks revenge on a world that wronged them, Jade Daniels, an angry, half-Indian outcast, pulls us into her dark mind when blood actually starts to spill into the waters of Indian lake--"
mythology,9780812513752,0812513754,Lord of Chaos,Book Six of 'The Wheel of Time',Robert Jordan,1995-11-15,https://books.google.com/books/about/Lord_of_Chaos.html?hl=&id=owkKhVCq6f0C,0812513754,"Fantasy fiction, Rand al'Thor (Fictitious character), Fiction, Fantasy, Fiction, fantasy, epic, Rand al'thor (fictitious character), fiction, American Fantasy fiction, Dragons, Fiction, fantasy, general, American literature",http://books.google.com/books/content?id=owkKhVCq6f0C&printsec=frontcover&img=1&zoom=1&edge=curl&source=gbs_api,A spectacular kidnapping and rescue.
mythology,9780356237503,0356237508,New Spring,,Robert Jordan,2004-03,https://books.google.com/books/about/New_Spring.html?hl=&id=wG2HvgEACAAJ,"{'title': 'New Spring', 'authors': ['Robert Jordan'], 'publishedDate': '2004-03', 'industryIdentifiers': [{'type': 'ISBN_10', 'identifier': '0356237508'}, {'type': 'ISBN_13', 'identifier': '9780356237503'}], 'readingModes': {'text': False, 'image': False}, 'pageCount': 334, 'printType': 'BOOK', 'maturityRating': 'NOT_MATURE', 'allowAnonLogging': False, 'contentVersion': 'preview-1.0.0', 'panelizationSummary': {'containsEpubBubbles': False, 'containsImageBubbles': False}, 'language': 'en', 'previewLink': 'http://books.google.com/books?id=wG2HvgEACAAJ&dq=title:new+spring+the+novel+inauthor:robert+jordan&hl=&cd=1&source=gbs_api', 'infoLink': 'http://books.google.com/books?id=wG2HvgEACAAJ&dq=title:new+spring+the+novel+inauthor:robert+jordan&hl=&source=gbs_api', 'canonicalVolumeLink': 'https://books.google.com/books/about/New_Spring.html?hl=&id=wG2HvgEACAAJ'}","Fiction, fantasy, general, Prophecy, Fiction, Good and evil, Fiction, fantasy, epic, American literature, series:The Wheel of Time, Fantasy fiction",,
classic,9781593080297,1593080298,The Metamorphosis and Other Stories,,Franz Kafka,2003,https://books.google.com/books/about/The_Metamorphosis_and_Other_Stories.html?hl=&id=UbXlAhQvKTQC,9781593080297,"Austrian Short stories, Criticism and interpretation, Fiction, German language edition, Literature, Metamorphosis, Translations into English, Continental european fiction (fictional works by one author), Fiction, short stories (single author), German Short stories, Manners and customs, Kafka, franz , 1883-1924, Pt2621.a26 a6 2009, 833/.912, Translations into Ukrainian, Ukrainian Short stories, Translations from German, Long Now Manual for Civilization",http://books.google.com/books/content?id=UbXlAhQvKTQC&printsec=frontcover&img=1&zoom=1&source=gbs_api,"Bringing together some of Kafka's finest work, this collection demonstrates the richness and variety of the author's artistry."
sci-fi,9780316268899,0316268895,"The Isolator, Vol. 2 (light novel)",The Igniter,Reki Kawahara,2016-01-26,https://books.google.com/books/about/The_Isolator_Vol_2_light_novel.html?hl=&id=-qd8zgEACAAJ,9780316268899,"Fiction, Science fiction, Orphans, Solitude, FICTION / Science Fiction / Adventure, Comics & graphic novels, manga, science fiction",http://books.google.com/books/content?id=-qd8zgEACAAJ&printsec=frontcover&img=1&zoom=1&source=gbs_api,"An alien parasite living inside of Minoru Utsugi gives him the power of Isolation--an unbreakable shield that surrounds his body. With this power, he's managed to defeat an evil Ruby Eye. Having done so, he's invited by the Accelerator--a girl named Yumiko--to join a mysterious organization whose goal is to defend humanity from the threat of the Ruby Eyes. Minoru agrees to join, with one condition: Once he has fulfilled his duty, the syndicate will erase all memory of his existence from the world--for Minoru seeks a world without any knowledge of him, a world of total and perfect isolation."
nonfiction,9781433679599,1433679590,The Love Dare,,"Alex Kendrick, Stephen Kendrick",2013,https://books.google.com/books/about/The_Love_Dare.html?hl=&id=SDtkAgAAQBAJ,9781433679599,"Love, religious aspects, christianity, Marriage, religious aspects, christianity, Married people, prayers and devotions, nyt:relationships=2014-09-07, New York Times bestseller",http://books.google.com/books/content?id=SDtkAgAAQBAJ&printsec=frontcover&img=1&zoom=1&edge=curl&source=gbs_api,"Presents a forty-day devotional of ""dares"" for parents, challenging one or both parents to understand, practice, and communicate Christ-like love to their children."
horror,9780765397409,0765397404,A Song for Quiet,,Cassandra Khaw,2017-08-29,https://books.google.com/books/about/A_Song_for_Quiet.html?hl=&id=Wx8iMQAACAAJ,9780765397409,"Horror tales, Fiction, Fiction, horror",http://books.google.com/books/content?id=Wx8iMQAACAAJ&printsec=frontcover&img=1&zoom=1&source=gbs_api,"Cassandra Khaw returns with A Song for Quiet, a new standalone Persons Non Grata novella from the world of Hammers on Bone, finalist for the British Fantasy Award and the Locus Award, and which Kameron Hurley called ""a long leap into the gory, the weird, and the fantastic."" Deacon James is a rambling bluesman straight from Georgia, a black man with troubles that he can't escape, and music that won't let him go. On a train to Arkham, he meets trouble — visions of nightmares, gaping mouths and grasping tendrils, and a madman who calls himself John Persons. According to the stranger, Deacon is carrying a seed in his head, a thing that will destroy the world if he lets it hatch. The mad ravings chase Deacon to his next gig. His saxophone doesn't call up his audience from their seats, it calls up monstrosities from across dimensions. As Deacon flees, chased by horrors and cultists, he stumbles upon a runaway girl, who is trying to escape the destiny awaiting her. Like Deacon, she carries something deep inside her, something twisted and dangerous. Together, they seek to leave Arkham, only to find the Thousand Young lurking in the woods. The song in Deacon’s head is growing stronger, and soon he won’t be able to ignore it any more."
